{
  "$schema": "./production-protocol-closure.policy.schema.json",
  "schema": "deep-production-protocol-closure-policy/v1",
  "repositoryUrl": "https://github.com/XPointLabs/deep-protocol.git",
  "repositoryType": "git",
  "packages": [
    {
      "id": "Deep.Protocol",
      "project": "src/Deep.Protocol/Deep.Protocol.csproj",
      "lockFile": "src/Deep.Protocol/packages.lock.json",
      "targetFramework": "net10.0",
      "packageReferences": [
        {
          "id": "Sodium.Core",
          "version": "[1.4.1]"
        }
      ],
      "projectReferences": [],
      "packInputs": [
        "build:Deep.Protocol.dll",
        "build:Deep.Protocol.pdb",
        "src/Deep.Protocol/runtimes/android-arm64/native/libdeep_mldsa.so",
        "src/Deep.Protocol/runtimes/android-arm64/native/libdeep_mlkem.so",
        "src/Deep.Protocol/runtimes/android-arm64/native/libdeep_mlkem_braid.so",
        "src/Deep.Protocol/runtimes/linux-arm64/native/libdeep_mldsa.so",
        "src/Deep.Protocol/runtimes/linux-x64/native/libdeep_mldsa.so",
        "src/Deep.Protocol/runtimes/win-arm64/native/deep_mldsa.dll",
        "src/Deep.Protocol/runtimes/win-arm64/native/deep_mlkem.dll",
        "src/Deep.Protocol/runtimes/win-arm64/native/deep_mlkem_braid.dll",
        "src/Deep.Protocol/runtimes/win-x64/native/deep_mldsa.dll",
        "src/Deep.Protocol/runtimes/win-x64/native/deep_mlkem.dll",
        "src/Deep.Protocol/runtimes/win-x64/native/deep_mlkem_braid.dll"
      ],
      "packTargets": [
        "lib/net10.0/Deep.Protocol.dll",
        "lib/net10.0/Deep.Protocol.pdb",
        "runtimes/android-arm64/native/libdeep_mldsa.so",
        "runtimes/android-arm64/native/libdeep_mlkem.so",
        "runtimes/android-arm64/native/libdeep_mlkem_braid.so",
        "runtimes/linux-arm64/native/libdeep_mldsa.so",
        "runtimes/linux-x64/native/libdeep_mldsa.so",
        "runtimes/win-arm64/native/deep_mldsa.dll",
        "runtimes/win-arm64/native/deep_mlkem.dll",
        "runtimes/win-arm64/native/deep_mlkem_braid.dll",
        "runtimes/win-x64/native/deep_mldsa.dll",
        "runtimes/win-x64/native/deep_mlkem.dll",
        "runtimes/win-x64/native/deep_mlkem_braid.dll"
      ]
    },
    {
      "id": "Deep.Protocol.MembershipRoutes",
      "project": "src/Deep.Protocol.MembershipRoutes/Deep.Protocol.MembershipRoutes.csproj",
      "lockFile": "src/Deep.Protocol.MembershipRoutes/packages.lock.json",
      "targetFramework": "net10.0",
      "packageReferences": [],
      "projectReferences": [
        "Deep.Protocol"
      ],
      "packInputs": [
        "build:Deep.Protocol.MembershipRoutes.dll",
        "build:Deep.Protocol.MembershipRoutes.pdb"
      ],
      "packTargets": [
        "lib/net10.0/Deep.Protocol.MembershipRoutes.dll",
        "lib/net10.0/Deep.Protocol.MembershipRoutes.pdb"
      ]
    },
    {
      "id": "Deep.Protocol.ProfileCarrier",
      "project": "src/Deep.Protocol.ProfileCarrier/Deep.Protocol.ProfileCarrier.csproj",
      "lockFile": "src/Deep.Protocol.ProfileCarrier/packages.lock.json",
      "targetFramework": "net10.0",
      "packageReferences": [
        {
          "id": "libsodium",
          "version": "[1.0.22]"
        },
        {
          "id": "Sodium.Core",
          "version": "[1.4.1]"
        }
      ],
      "projectReferences": [
        "Deep.Protocol"
      ],
      "packInputs": [
        "build:Deep.Protocol.ProfileCarrier.dll",
        "build:Deep.Protocol.ProfileCarrier.pdb",
        "src/Deep.Protocol.ProfileCarrier/README.md"
      ],
      "packTargets": [
        "lib/net10.0/Deep.Protocol.ProfileCarrier.dll",
        "lib/net10.0/Deep.Protocol.ProfileCarrier.pdb",
        "README.md"
      ]
    }
  ]
}
